{
  "schema": "simforge.scenario-cell/v1",
  "mapId": "yale-street",
  "siteId": "22f66ed9554e1403",
  "drawIndex": 0,
  "manifest": {
    "kind": "scenario-instance-manifest",
    "manifestVersion": 1,
    "replayKey": {
      "templateId": "ec-05-05-cyclist-occlusion-conflict-v2",
      "templateVersion": 2,
      "templateDigest": "fc6cca16e511e5f6",
      "mapId": "yale-street",
      "matcherIndexDigest": "33eb942298b3492266d0582782f020ef121cc1d8da08bcb3080c9b71ea01f95e",
      "engineGraphDigest": "fbebbdccd6a6b5dfa18a321d74009dede3851f18b673a9b807e6f1b5ea3b17d5",
      "siteId": "22f66ed9554e1403",
      "matcherVersion": "1.0.0",
      "solverVersion": "0.2.6",
      "paramSeed": "ec-05-05-cyclist-occlusion-conflict-v2",
      "drawIndex": 0
    },
    "instanceId": "ec-05-05-cyclist-occlusion-conflict-v2#0",
    "archetype": "gallery.05-cyclist-occlusion-conflict",
    "negativeControl": false,
    "metricSubject": "focus-vehicle",
    "operationalVariant": null,
    "site": {
      "siteId": "22f66ed9554e1403",
      "score": 0.7275,
      "verdict": "degraded",
      "originFeatureId": "seg_9904846a45722993",
      "entryLaneRsl": "95:3:1",
      "egoTurn": null,
      "degradationSummary": "Degraded match (score 0.73). speeds clamped to the site limit 64 kph (arrival invariants re-solved over the speed parameter). corridor.speedLimitKph worst value 64 at s=0 m, wanted [20, 50]. corridor.throughLanesOpposing worst value 2 at s=20 m, wanted [0, 1]. Presentation was relaxed; the scenario still tests what it was written to test.",
      "matchedReasons": [
        "corridor.curvatureDegPer10m holds over the whole interval (worst 0)",
        "every required adjacency present along the corridor",
        "144.21 m of runway available, 100 m needed",
        "0 m of runway available, 0 m needed",
        "corridor.throughLanesSameDir holds over the whole interval (worst 1)",
        "parking_zone loc_9d1bf6b49c53986f6e265315 at s=80.86 m (same-road station, 5.52 m lateral)",
        "parking_zone loc_9d1bf6b49c53986f6e265315 is on the left side of travel",
        "pedestrian: pose s=-4 m is outside the reference path",
        "legal-cyclist: pose s=-42 m is outside the reference path",
        "matched in mirror (policy.allowMirror)"
      ]
    },
    "params": {
      "values": {
        "creepSpeedKph": 4,
        "wrongWaySpeedKph": 25
      },
      "categorical": {},
      "rejectedConstraints": []
    },
    "actors": [
      {
        "id": "delivery-truck",
        "actorKind": "truck",
        "roleKind": "supporting",
        "laneRsl": "92:0:1",
        "spawnS": 1.0552738595725177,
        "initialSpeedMps": 0,
        "bindingStatus": "bound"
      },
      {
        "id": "focus-vehicle",
        "actorKind": "car",
        "roleKind": "focus",
        "laneRsl": null,
        "spawnS": 0,
        "initialSpeedMps": 0,
        "bindingStatus": "scene-absolute"
      },
      {
        "id": "pedestrian",
        "actorKind": "pedestrian",
        "roleKind": "supporting",
        "laneRsl": null,
        "spawnS": 0,
        "initialSpeedMps": 1.1111111111111112,
        "bindingStatus": "scene-absolute"
      },
      {
        "id": "wrong-way-rider",
        "actorKind": "bicycle",
        "roleKind": "supporting",
        "laneRsl": null,
        "spawnS": 0,
        "initialSpeedMps": 0,
        "bindingStatus": "scene-absolute"
      }
    ],
    "props": [
      {
        "id": "garage-wall",
        "catalogId": "construction.jersey_barrier_run",
        "pose": {
          "x": 387.41772868128226,
          "z": -1821.1402807150862,
          "headingRad": -2.154996495799935
        },
        "dims": {
          "l": 12.2,
          "w": 0.61,
          "h": 0.81
        },
        "scale": 1.5,
        "collidable": false,
        "essentiality": "required",
        "occludes": {
          "observer": "focus-vehicle",
          "target": "wrong-way-rider"
        },
        "targetRevealToConflictS": 1.2
      }
    ],
    "arrival": [],
    "inputHash": "c43eed9f22a1b8efbc112676ba33dfee230d6bffa5bba6859faabb25d0c40f93",
    "feasible": true,
    "issues": [],
    "notes": [
      {
        "path": "choreography.interactions.focus-vehicle-garage-route",
        "reason": "route(polyline) at t=0 folded into focus-vehicle's spawn route (2.9 m), so the arrival solver can place the actor along it"
      },
      {
        "path": "choreography.interactions.pedestrian-crosses",
        "reason": "route(polyline) at t=0 folded into pedestrian's spawn route (5.1 m), so the arrival solver can place the actor along it"
      },
      {
        "path": "choreography.interactions.contraflow-route",
        "reason": "route(polyline) at t=0 folded into wrong-way-rider's spawn route (100.0 m), so the arrival solver can place the actor along it"
      },
      {
        "path": "props.garage-wall",
        "reason": "occlusion declared between focus-vehicle and wrong-way-rider; reveal-to-conflict is reported by the engine, not solved for"
      }
    ],
    "contractMigration": {
      "schema": "simforge.native-input-contract-reseal/v1",
      "sourceSha256": "b937f386dac6beed6e2d6e18eddcddc9d7b744199a3f0dd6d73290962f269d13",
      "sourceInputHash": "1a9ed1eb72741f1866ceb58b5ad2f48f51a91cff73f25da60adeedf3b6e76a9a",
      "targetAbi": 2,
      "removedMasterFlags": 4,
      "foldedFalseMasterFlags": 0,
      "scope": "Rule-contract reseal only; authored poses, actors, actions, thresholds and signals unchanged. Replay metadata retains its historical materialization provenance."
    }
  }
}
