{
  "schema": "simforge.scenario-cell/v1",
  "mapId": "el-camino-road",
  "siteId": "1f964815a5bfd7cb",
  "drawIndex": 0,
  "manifest": {
    "kind": "scenario-instance-manifest",
    "manifestVersion": 1,
    "replayKey": {
      "templateId": "ec-07-07-protected-left-red-runner-v2",
      "templateVersion": 2,
      "templateDigest": "7b74b6fb75b9e608",
      "mapId": "el-camino-road",
      "matcherIndexDigest": "986a9135415f3b045a7fb5d8f552bea3a1e7bdc9f35aba33e70092ee1dbd91d0",
      "engineGraphDigest": "00293fb5a40e6665257770f20eddbd0cbd711b301cce17496544c0e1fa15900a",
      "siteId": "1f964815a5bfd7cb",
      "matcherVersion": "1.0.0",
      "solverVersion": "0.2.5",
      "paramSeed": "ec-07-07-protected-left-red-runner-v2",
      "drawIndex": 0
    },
    "instanceId": "ec-07-07-protected-left-red-runner-v2#0",
    "archetype": "gallery.07-protected-left-red-runner",
    "negativeControl": false,
    "metricSubject": "focus-vehicle",
    "operationalVariant": null,
    "site": {
      "siteId": "1f964815a5bfd7cb",
      "score": 0.5335,
      "verdict": "degraded",
      "originFeatureId": "junction:590",
      "entryLaneRsl": "128:1:-3",
      "egoTurn": "left",
      "degradationSummary": "Degraded match (score 0.53). speeds clamped to the site limit 64 kph (arrival invariants re-solved over the speed parameter). corridor.speedLimitKph worst value 64 at s=-45 m, wanted [20, 55]. Presentation was relaxed; the scenario still tests what it was written to test.",
      "matchedReasons": [
        "59.46 m of runway available, 45 m needed",
        "95.36 m of runway available, 45 m needed",
        "corridor.throughLanesOpposing holds over the whole interval (worst 3)",
        "corridor.throughLanesSameDir holds over the whole interval (worst 5)",
        "origin feature sits at s = 0 by construction",
        "4-arm junction",
        "conflicting opposing right movement crosses the focus-vehicle path at 0°",
        "signalized junction as requested",
        "reference path turns left",
        "junction has a marked crossing",
        "crossing loc_db13e7605599f19b2d8f3c78 at s=18.86 m (projected 5.31 m from feature point)",
        "mobility-scooter: walks the crossing loc_db13e7605599f19b2d8f3c78 left_to_right",
        "cyclist: walks the crossing loc_db13e7605599f19b2d8f3c78 right_to_left",
        "red-runner: bound to gate 590:11:-6--1 (opposing right), crossing at 0° (template 135°)",
        "matched in mirror (policy.allowMirror)"
      ]
    },
    "params": {
      "values": {
        "scooterSpeedKph": 4.5,
        "cyclistSpeedKph": 19
      },
      "categorical": {},
      "rejectedConstraints": []
    },
    "actors": [
      {
        "id": "cyclist",
        "actorKind": "bicycle",
        "roleKind": "supporting",
        "laneRsl": null,
        "spawnS": 0,
        "initialSpeedMps": 0,
        "bindingStatus": "scene-absolute"
      },
      {
        "id": "focus-vehicle",
        "actorKind": "car",
        "roleKind": "focus",
        "laneRsl": "128:0:-3",
        "spawnS": 79.36108146758178,
        "initialSpeedMps": 0,
        "bindingStatus": "bound"
      },
      {
        "id": "mobility-scooter",
        "actorKind": "scooter",
        "roleKind": "supporting",
        "laneRsl": null,
        "spawnS": 0,
        "initialSpeedMps": 1.25,
        "bindingStatus": "scene-absolute"
      },
      {
        "id": "outer-pickup",
        "actorKind": "truck",
        "roleKind": "supporting",
        "laneRsl": "627:0:-1",
        "spawnS": 1.997384110080148,
        "initialSpeedMps": 0,
        "bindingStatus": "bound"
      },
      {
        "id": "red-runner",
        "actorKind": "car",
        "roleKind": "supporting",
        "laneRsl": "729:0:-1",
        "spawnS": 51.201696198102994,
        "initialSpeedMps": 5,
        "bindingStatus": "bound"
      }
    ],
    "props": [],
    "arrival": [
      {
        "interactionId": "role:red-runner",
        "actorId": "red-runner",
        "referenceActorId": "focus-vehicle",
        "spawnDeltaS": 116.31800661424279,
        "spawnS": 116.31800661424279,
        "targetDeltaT": 13.5,
        "achievedDeltaT": 13.500037368944017,
        "achievedTtc": -13.500037368944017,
        "fireTime": 19.716833522165306,
        "iterations": 18,
        "converged": true
      }
    ],
    "inputHash": "12db015ea56f3e6eb16075dc76b8d64b9142f23d4ed9af84aa8bd89983320fb0",
    "feasible": true,
    "issues": [],
    "notes": [
      {
        "path": "signalPrograms",
        "reason": "22 physical map signal head(s) bound as 4 logical program(s) to junction 590 with authoritative OpenDRIVE controller-stage provenance; phase durations and t=0 state use the explicit synthetic-default cycle because authoritative timing/state data is absent"
      }
    ],
    "contractMigration": {
      "schema": "simforge.native-input-contract-reseal/v1",
      "sourceSha256": "cd0f766322efb25b42e2dde4220e867a6312d27cbcade0e3a330f0738515df0e",
      "sourceInputHash": "d1950d17927500b4f977fc1542ce73da038d1af70bba1c1d9aefc26827bb8ccf",
      "targetAbi": 2,
      "removedMasterFlags": 5,
      "foldedFalseMasterFlags": 0,
      "scope": "Rule-contract reseal only; authored poses, actors, actions, thresholds and signals unchanged. Replay metadata retains its historical materialization provenance."
    }
  }
}
